Article,Category
business day business slogans lights matthew goldsteinmarch share page businesses puerto rico months hurricane maria island credit rojas juan message investment conference february puerto rico business attendees juan restaurants traffic capital city months hurricane maria puerto parts island dark way business conference states territory business opportunities pace recovery attendance billionaire john paulson hotel owner island speaker conferences hedge fund managers investments rico reminders economy state sept maria category storm night conference parts juan darkness hours explosion fire power station island patchwork power grid hundreds thousands power blue tarps december makeshift roofs tens thousands homes credit mario tama getty government relief workers tarps makeshift roofs homes island plan roofs advertisement intersections juan traffic lights businesses percent island total remain mall anchor stores avenue nordstrom storm damage nordstrom months hotel workers cabdrivers bartenders juan power estimate puerto rico year recovery power restructure finances court process storm maria things percent island residents poverty unemployment rate percent homeowners foreclosure insurance aid emergency management agency individuals program assistance disasters expenses insurance programs juan arecibo lo za aguadilla puerto rico guaynabo el yunque forest ez orocovis caguas ponce juan arecibo baja lo za aguadilla guaynabo el forest rico caguas mayag ez ponce juan arecibo baja toa baja lo za aguadilla bayam carolina guaynabo el forest rico caguas mayag ez ponce juan arecibo baja toa baja lo za aguadilla bayam carolina guaynabo el forest rico caguas mayag ez humacao vieques ponce juan arecibo baja toa baja lo za aguadilla bayam carolina puerto rico guaynabo el forest mayag ez humacao vieques note figures source emergency management agency karl russell storm disaster zapata rodr director development pathstone enterprise center businesses puerto rico capital flowing lot businesses shop hurricane problem insurance claims percent hold requests emergency grants dollars economy money tourism percent island economy jobs season dozen resorts conquistador caribe ritz carlton juan hotels tourists workers government contractors rates ritz carlton juan reconstruction credit rojas blackstone group condado plaza hilton salaries health benefits hundreds workers credit rojas sign condado hilton blackstone group equity firm rooms relief work government work blackstone el conquistador salaries health benefits hundreds workers others tourism business right percent business matos husband puerto rico outings tourists year business access rain storm damage gsi people company business relief workers residents mainland companies people construction projects factories steel report year reserve bank york months percent puerto businesses workers percent equipment storm waste plans ponce city rico coast pathstone businesses workers weeks pathstone partnership york fed event businesses financing banks lenders representatives businesses search help mr zapata rodr guez third companies puerto rico power newsletter sign please box email address please enter newsletter updates offers products services thank error try view newsletters manage email preferences policy opt fragility power grid hundreds thousand customers juan island coast power middle workday generators maria starbucks stores puerto generators power failure meeting david rodriguez caguas plans business sale generators rodriguez puerto rico telecommunications engineering firm rochester island december family uncle gasoline generator health risk uncle generator indoors rodriguez center puerto rico plans business sale generators credit rojas experience mr rodriguez company inversol generators roofs power blackouts company people generators year humanity rodriguez challenge location factory pathstone farmworkers experience equipment search workers swath businesses vazquez marrero business precast walls steel workers maria workers island industries company insurer storm losses workers hires knowledge things puerto auto sales percent january part people vehicles villamil estudios research firm people mortgage payments data firm construction industry investment conference talk rico tax environment investors states china others island reputation haven cryptocurrency start brokers realty hallway conference room interest luxury waterfront homes community dorado puerto rico business sec laboy ddec pr investment summit feb investors island grid moratorium home foreclosures housing agency mid billions dollars washington grid housing development projects package tens billions experts businesses homeowners insurance claims payouts credit rojas insurance money claims homeowners businesses payouts insurance department money grants loans businesses individuals emergency management agency business administration others hold fema grant dollars lawyers community groups fema percent hold applications agency figure applicants loans business administration aid agencies reason rejections puerto ricans home percent properties territory government problem acute cities areas custom property owners titles homes za community damage homes businesses businesses town months power residences businesses week funds za housing groups reason slowness proportion homes percent makeshift fema center agency workers property owners declaration home advocates horses beach pace recovery worries business leaders sep lveda vice president banco puerto rico lender concern shortage workers ly construction mr sep lveda morell pessimism puerto rico prospects follow matthew goldstein twitter version article print march page york edition headline recovery order reprints paper feedback page coverage street firms puerto rico crisis puerto rico crush foreclosures senators delay rico dec ,Business
business day cohn departure wall st david gelles kellymarch share page cohn tuesday chairman council gatekeeper executives credit tom outset cohn choice president adviser goldman sachs president proponent trade mr cohn pedigree views trump rhetoric protectionist policies approach president style mr cohn tuesday director council trump administration something president respect executives business leaders loss country positions growth orientation economy perspective topics trade executive boston group trump business advisory panels year policy meetings mr cohn advertisement mr cohn tax law year legislation corporations policy achievement mr trump year office president tariffs steel aluminum mr cohn business allies pity gary moment executive chairman dowdupont panel voice issue markets arc august rumors wake mr trump response violence charlottesville va stock prices administration spokesman mr cohn news resignation stock futures trading index percent everyone street business community sonnenfeld professor school management oasis silver trader way job york commodity exchange executive sachs mr cohn nuances markets organizations worldview trader mr cohn commodity price swings money views manager goldman frustration executive surprise decision job trump administration newsletter please box email address please enter newsletter updates offers products services thank error try view newsletters manage email preferences policy opt background voice street administration mantle admiration antipathy economics trade bill george goldman board member influence administration kathryn executive partnership york city business group cohn resource washington somebody york business community industry someone business industry push tuesday blankfein goldman executive cohn message twitter cohn deserves credit country class way cohn deserves credit country class way others blankfein mr cohn role administration lawmakers senator democrat massachusetts appointment job someone firm crisis recession trump core supporters mr cohn background foe agenda trump presidency aides globalist gary news article globalist cohn trump agenda mr cohn critics timing departure tariff proposals president charlottesville episode staffer breaking point ron klain chief staff vice presidents gore point tariffs president remarks charlottesville breaking point mr goldman director mr cohn president remarks mr george months york something world night mr trump successor people job twitter correction version article title dowdupont chairman company executive david gelles corner office columnist business reporter twitter dgelles feedback page coverage cohn trump adviser march news analysis voice trade proponents march ,Business
business day president speaks david gellesfeb share page kenneth executive speaking company headquarters kenilworth week credit mike cohen nation executives silence president trump year executive pharmaceuticals company trump business advisory councils days administration trump response outburst violence august charlottesville groups mr grandson man slavery series executives president responsibility stand extremism merck twitter account time interview mr frazier time motivation stance advertisement view stand endorsement think words consequences actions consequences matter conscience spoke corner office column series interviews business leaders feature fall month fuller interview mr frazier range topics career merck efforts cancer events confrontation president summer weekend nationalists charlottesville removal statue lee bloody counterdemonstrators self car crowd people night news saturday woman others person people views mr frazier president response mr trump speaking veterans event golf clubs violence nationalists slogans bigotry violence sides sides president remarks condemnation actions counterprotesters nazis americans mr frazier moment president response concordance views frazier think concordance views country decision president council frazier merck board statement terms values company support board percent morning merck statement twitter president manufacturing council part country strength diversity contributions men women faiths races orientations beliefs twitter com pnqzism merck merck president twitter frazier merck pharma president council time ripoff drug prices president frazier merck pharma president council time ripoff drug prices realdonaldtrump aug frazier voice opposition business leaders executives support night executives intel armour groups dozens country top chief executives conclusion part groups decision president think merck company something discussion country economy president thing company merck newsletter sign please box email address please enter newsletter updates offers products services thank error try view newsletters manage email preferences policy opt trump remarks charlottesville time odds president things administration immigration climate change didn role issues process issues country trump unwillingness nationalists case politics mr values country president tweet episode man pinnacle america mr frazier grandfather slavery carolina father janitor philadelphia parents things hi country americans siblings opportunity responsibility advantage opportunities pennsylvania state university degree harvard law school drinker reath law firm philadelphia merck work summers south africa law students case james cochran inmate death row store manager evidence mr frazier colleagues mr cochran innocence trial thing life stop frazier man execution date crime mr frazier merck ranks company defense lawsuits drug vioxx executive development drugs cancer priority merck treatment river blindness people spark lot responsibility mr frazier tenure executive mr calls research development spending profitability value company frazier interest feud trump politics summer stance mr frazier weekend think issue issue core americans corner office conversation leader question name address information reporter editor columns articles corner office content anyone infringe copyright trademark anyone rights submission manner media right parties terms service thank submission david gelles corner office columnist business reporter twitter dgelles version article print page york edition headline executive trump council values order reprints paper feedback page coverage voice america dealbook wrath president aug ,Business
wework spaces manhattan years wework network working spaces credit cole wilson wework manifesto office space world brash founders wework network office spaces nothing way play david gellesfeb share page morning brooklyn skeleton building construction site river cruise ship glass structure century docks notice neighborhood economy project dock brainchild wework york years wework network spaces globe wework executive founder adam isn content offices lanky year nothing way dock year timeline expression mr vision date co space luxury spa offices companies ibm verizon wework bar bar gym studio basketball court vistas manhattan restaurants cleaning services barbershop kind place neumann way apartments advertisement sort ambition mr neumann brash pitchman strangers share beer office wework society world mr neumann interview people place people work environment wework building construction brooklyn building expression company vision date credit cole wilson globe companies mr neumann co founder miguel mckelvey wework countries executive team members companies chase siemens tenants revenues year wework year lord taylor building avenue manhattan company headquarters deal part investment technology group billionaire masayoshi son company offering gym network person gatherings school academy company profit school september wework plans wave pools inland company co instructors teachers scientists software engineers biologists psychologists company core business ve argument dunlevie wework board member partner venture capital firm benchmark entrepreneurs don guys wework expands directions questions valuation durability business model critics company estate arbitrage space tenants company properties assets growth projections expectations number loom competitors wework success wework tenants start ups co company members estate wework neumann investors wework figure explanation valuation wework speaks chris founder president convene company event spaces estate firms spreadsheet calculation energy brand people valuation terms wework metrics point wework isn estate company state consciousness generation entrepreneurs mr combination inspiration chutzpah way world world founders wework bring people place people work environment credit peter prato plan company mark desks refreshments mr son wework investor company years multibillion dollar investment bargain plan forbes year manner valuation dollars notion workers offices s england skyscrapers manhattan offices places space row desks kind model anyone workplace factory author hi workplace office assembly line state affairs earnest dot com tech companies offices beanbags tables work spaces food commonplace expectations amenities design mainstream employees millennials offices wework people employers jobs cities technology demand working neumann kibbutz israel bring vibe office mr oregonian collective architect eco space brooklyn wework miguel ground mr neumann communities members miguel co founder people companies space wework credit cole wilson wework didn invent co spaces course regus decades neumann mr mckelvey recipe throngs start ups chic areas comfy couches beer pop music individuals month access area start ups dollars room month month basis companies millions dollars year spaces thousands employees locations york aviv york wework spaces wework harlem dance companies share space hair care start ups area murals jazz musicians wework fashion designers alcohol distributors shoulder space wework way corporations space thousands employees strategy reversal wework name catering freelancers weather channel ad sales team wework manhattan barbara bekkedahl group transition space bekkedahl complaint downsides work space hygienic habits office mates advertisement tv sales team dress sales techie types d wework aren customers day standards gripes wework business clients neumann promise money wework space buying furniture mr neumann office fraction cost companies economies scale costs instance mr neumann game fact companies salesforce microsoft years companies payroll services security design maintenance offices company wework members mckelvey newsletter sign please box email address please enter newsletter updates offers products services thank error try view newsletters manage email preferences policy opt bankers lawyers skyscrapers suburbs monday night district street building wework party year era office tower use development mr design space ground floor restaurants fuku momofuku milk bar bar mail room complex apartments term basis tenants signature wework aesthetic wood wrought iron perks tubs terrace games pool table room kitchen dining room bar floor hour tempranillo advertisement dining area brothers jake jimmy decicco dozen media influencers enthusiasm protein coffee company rib eye steaks brussels sprouts brand markets beers anyone rise gym wework building street manhattan credit cole wilson area street credit cole wilson room welive street pool table arcade games wework founders office environment throngs start ups chic areas comfy couches beer pop music credit cole wilson brothers work wework space exercise wework rise jake decicco bed elevator share beer words music ears work living environment people fact world innovation wework community manager tabs members introductions activities strangers grapefruit water thinking start ups world place wework part something neumann people elevator stairways things elevators world innovations wework steps fraternization beer kegs companies consumption alcohol virtue posters wall encourage people drink tastings company parties shelf liquor mr neumann penchant tequila bar office tuesday community manager wework manhattan email time juices join th floor wine paint picture noon day invitation share wine cake area alcohol lubricant others women stories culture weworks wework scandals company company dispute group janitors subcontractor wework year wework use arbitration workplace disputes firing employee policy nothing labor disputes questions business fundamentals publicity company trajectory disrupter way people spaces day day basis dunlevie benchmark days advantage phenomenon september wework project date effort wework sun creation mr wife school wegrow space curriculum entrepreneurship year olds wegrow fits vision generation impact entrepreneurs risk reward calculus school wegrow scale wework upside something fallout thing internet paper printer thing responsibility health development someone aspirations year hallway rise gym credit cole wilson ms neumann background education website student life superpower intuition accreditation state team career educators applications school year tuition toddlers year school simpler business mr neumann education world change kids mr neumann leather couch chelsea office york city apartments conference table video desks spreads food peloton exercise bike machine bag ceiling gong antechamber assistants bathroom d mistakes percent mistakes zeal mark savant walter biographer steve jobs benjamin franklin da vinci friend attributes titans feel millennials community work experiences corporations isaacson jobs entrepreneurs humanities business technology life wework rhetoric flush money investors design beer invitation strangers claims paradigm workers education world kind prattle touch moment backlash tech pitfalls concern mr show night mr strode onstage theater madison square garden spotlights leather biker jacket shirt host party celebration wework community mr neumann company creator part celebration wework community january madison square garden credit cole wilson samantha snabes re prizes creator awards credit cole wilson night festivities oversee shark tank competition businesses start prosthetics food delivery service refugees prize mr neumann company achievements ambitions performer grammy macklemore backstage mr impromptu riff people life company motto mr neumann entrepreneurs course lot sense line hundreds employees room mr son nickname mr neumann admission point money time winner mr neumann announcement recipient wework companies company vision nonprofit prescription glasses people world couple half dozen finalists rafters winners stage mr money bull set damn technology macklemore performing creator awards rapper awards onstage damn technology credit cole wilson david gelles corner office columnist business reporter twitter dgelles version article print page bu york edition headline office space world order reprints paper feedback page coverage life feb wework start clashes cleaners ,Business
byop ed obamaby jessica imagethe parker portrait gallery ben hines party obama creditben hines facebookit day daughters portrait gallery paintings barack obama day year parker coat outfit underneath show headband head camera parker child movies fries aunt jana mrs obama obama degeneres tv show washington museums family parker portrait gallery galleries museums city portrait lady name camera painting backdrop grandeur image time didn someone hines minister town carolina daughter reverie mr hines line portrait mother parker addition tv stations outlets washington post buzzfeed ran stories parker people decades strangers globe way messages strangers washington portrait daughter picture thing things evidence woman america man girl someone michelle belief president person women messages home fact representation matters raise daughters opportunity women things kind women girls girls color goals dreams reach parker popularity mrs obama unveiling portrait february people girls girls color years place image someone wall institution interview buzzfeed parker obama chance lady week obama kind shoes parker song taylor swift parker dress obama shoes moment tears joy days parker grandparents america president lady granddaughter day dance lady parker embodies words girl woman color gender race parker adult individuals dream generation regardless obamas fabric hi thanks children daughter jessica curry business owner washington creator motherhood blog mama babies opinion section facebook twitter nytopinion opinion newsletter advertisement ,Business
business day life weworld david gellesfeb share page david gelles room apartment building street manhattan amenities bed credit cole wilson wework co spaces company ambitions hospitality wellness industries welive apartments night week months time gym wework bubble day weworld brief monday subway district company apartment building wall street tour amenities pool tables bars drop tasting bar floor meet yehuda computer engineer food delivery start food dorm co founders share bedroom apartment office hall apartment dinner party co founders chandramohan egg tofu curry strangers food investor company home chip cookies soup salmon mushrooms cauliflower westville ground floor building take dinner dining room brothers protein coffee company dinner media influencers samples beer credit cole wilson retire studio apartment night floor bathroom plenty closet space bed discreet nook desk kitchen month utilities tv end bachelor arie advertisement lights toddlers home chance bank tuesday didn sleep newsletter please box email address please enter newsletter updates offers products services thank error try view newsletters manage email preferences policy opt bottle coffee news iphone stuff half mile pouring rain skyscraper district basement memberships month tour space treadmills bags saunas massage advertisement take flow yoga class teacher jooin im class poetry nothing salutations oms day soak bath skin care products malin goetz kale salad protein shake rise head floor noon lunch coffee call world david gelles corner office columnist business reporter twitter dgelles version article print page bu york edition headline life weworld order reprints paper feedback page coverage wework manifesto office space world feb ,Business
