Article,Category
advertisementdealbook business bybook entryreview questions virtues businessimage argues businesses driver productivity record issues pressby jonathan topics populace virtue business decline family farm coast realist role firms job creation silicon valley entrepreneur dreaming status quo restaurant garden everyone reason businesses view robert atkinson michael authors myth business america predisposition guy effect economy society evidence mr atkinson mr lind opposition cult business america authors indicator wages productivity protection employment diversity tax compliance firms group firms wisdom businesses engine job growth economy attack points research job creation origin business job creation myth majority businesses account job losses contribution job creation research article notes ups company anyone founder years number attitude superiority firms fact share employment economy firms engine job growth job seekers systematically wages benefits diversity times unemployment consensus favor things array laws benefits exemptions authors policy wonks careers succession think tanks devote book history rules alternatives approach tax dozens topics popularity neutrality defends policy proposals benign principle size neutrality arguments positions view overuse policy jargon instance philosophy developmentalism opponents approach enforcement brandeisians way companies medium ones validity policy prescriptions data mr atkinson mr lind question wisdom attitudes business relative law society look trends graduates programs firms percent graduates programs investment banking management consulting jobs decline attractiveness industries mater stanford business school percent graduating class investment banking stanford heart silicon valley today graduates company percent preference business extends stanford symposium business schools columbia business school dean harvard business school percent graduates companies employees shift companies employers preference business schools conference wharton dean form action company recruitment efforts atkinson mr lind businesses driver productivity record issues rejection corporations corporations facebook scandals blame disfavor contempt interest ways corporations trust graduates knee professor practice columbia business school advisor book class clowns investors billions education advertisement ,Business
business day business highlights pressmay share page apple tax break yields dividend boost stock calif apple tax break profits boon shareholders iphone maker dividend percent cents share boost apple payment apple buying shares move stock price tuesday announcement time apple glimpse shareholders overhaul tax code decision tariffs eu trump administration days tariffs steel aluminum imports union canada delay period uncertainty businesses regions avoids trade war europe eu exemption tariffs goods zuckerberg kicks facebook conference apologysan jose calif mark zuckerberg facebook conference apology privacy scandal array features service video feature instagram way users history facebook guitar maker gibson bankruptcy protectionnashville tenn maker gibson guitar omnipresent music stage decades bankruptcy protection years debt gibsons generations guitar legends chuck berry cherry guitar inside coffin slash swears reorganization plan tuesday gibson brands operations financing lenders businesses trade warswashington trump administration trade fight europe steel aluminum tariffs move uncertainty businesses materials group uncertainty strategies businesses blow trade fights business look supply alternatives work partners advertisement california sues plan car emission standardssacramento calif ap california states trump administration tuesday plans standards vehicle greenhouse gas emissions gas mileage rules suit gov jerry brown state attorney xavier becerra aim plan protection agency emissions standards vehicles email re enter updates products error ceo caught tv singing money sainsbury ceo camera singing money purchase unit asda coupe itv interview pound deal caught camera tune street pace growth aprilwashington ap manufacturers pace expansion april factories output shortages workers institute supply management trade group purchasing managers tuesday manufacturing index month march reading score signals growth apple stocks lossnew york ap stocks losses apple technology companies companies companies goods makers energy companies oil prices steelmakers house tariffs aluminum steel imports investors data index points percent dow points percent composite points percent russell index company stocks points percent crude percent york brent standard percent gasoline percent gallon heating oil percent gas percent feet feedback ,Business
bybusiness pressapril growth pace washington economy growth rate quarter consumer spending performance years march increase hopes rebound rest year commerce department reports gain product economy output goods services rise quarter mode giants kids fixes amount york ap tech companies changes services kids critics kids services critics facebook amazon google edges instance parents kids kids questions products kids resorts wynn name casinoboston resorts massachusetts casino year name company founder wynn misconduct allegations matthew maddox friday plans casino boston harbor boston harbor moniker las vegas wynn chairman ceo shares allegations subscription service moviepass ap moviepass startup customers movie day theaters month customers movies month move sustainability moviepass business model question moviepass theaters price ticket service money movies month moviepass promotions rates movie day moves ban pesticides harm beesbrussels union breakthrough pesticides harm bees crop pollination member states majority ban prevalent neonicotinoid pesticides effect end year exxon revenue oil prices profit motorists cents gallon spring trouble profit oil prices quarter profit percent oil giant quarter years production results corp friday street expectations company shares technology tries companies devices online services distraction products waste time update windows computer system monday features people distraction zone money pot taxes colorado teachers colorado teachers salaries funding schools questions state marijuana sales problems voter amendment marijuana sales adults commitment millions dollars schools taxes share multibillion dollar education budget tech woes toronto stock markettoronto toronto stock exchange exchange day result problems toronto company exchanges decision twitter spokeswoman toronto tmx group company cause disruption stocks leads rally sinksnew york stocks jumps profit quarter retailers technology companies gain apple alphabet intel fall microsoft oil giant exxon mobil cable provider charter communications stocks summit leaders index points percent dow jones average points percent composite points russell index company stocks points percent crude percent york crude price oils percent barrel gasoline percent heating oil percent gas percent feet advertisement ,Business
business day business highlights pressapril share page hope visit delay tariffswashington ap treasury secretary steven delegation officials week analysts trade conflict china outcome one talks delay series tariffs nations goods windows adapts business importance declinesredmond wash ap earnings report windows core business complement company offerings company money windows share business thursday quarter revenue increase percent year contrast windows revenue percent profit doubles shares york ap quarter profit year wall street expectations stock percent hours seattle company income share months march earnings share per share analysts bookings fall accidentdallas inspections jet engines airlines fan blade year others week investigators flight southwest executives thursday fan blades signs metal fatigue mid bookings accident southwest advertisement oregon pot problemsalem oregon data marijuana industry workers businesses experience challenge pot industry ability governments markets state contractors problems sales computer system months advertisement mortgage rates year washington ap term mortgage rates week level years home purchasers prospects spring buying season week increases term mortgage rates mortgage buyer mac rate year rate mortgages percent week rate year rate loans percent week email re enter updates products error anytime interest stocks comeback york ap investors stocks percent days market losses gains trade dispute china record highs january analysts market direction bank growthfrankfurt germany bank interest rates settings signs economy markets bank president mario draghi assessment news conference stand pat decision bank member council facebook tech stocks york ap stocks facebook technology companies market interest rates year highs days stock price month data privacy scandal shares controversy didn media platform business quarter technology companies alphabet microsoft losses index points percent dow jones average points percent technology nasdaq points percent russell index company stocks points percent oil percent york brent crude price oils percent gasoline percent heating oil percent gas percent feet feedback ,Business
bybusiness pressapril sears shareholder offers york ap sears shareholder company kenmore brand estate holdings buyer company brands remainder powerhouse retailer world wars depression home sales percent marchwashington sales homes percent basis march buyers number properties market association realtors homes month pace sales rate sales months damage warshanghai consumer brands press partnerships commerce giant alibaba traffic products sales companies billions revenue alibaba perks exclusivity anyone trump coal mean president donald trump coal miners administration wind energy projects offshore leases power projects east coast goal grid energy power millions homes projects jersey virginia york survey economists outlook tax cutswashington ap america business economists picture months survey companies sales pay time thirds respondents survey association business economics president tax cuts way hiring investment plans court wrestles law judge casewashington court case adviser buckets money strategy raymond lucia appointment law judge case securities exchange commission law judges potential impact law judges government summer movie preview hollywood actionlos angeles summer year hollywood record release avengers war thursday marquee marvel superheroes time box office year percent industry summer hits wonder woman performance decade denver price value denver post cry help form editorial ownership colorado community tries rescue mission paper denver newspaper industry ad revenues lights sales plunge york repercussions demise toys hasbro loss plunging revenue quarter hasbro sales toys stores ad sales parent alphabet view calif ap google parent alphabet jump quarter income back ad sales accounting adjustment mountain view california company income percent expectations revenue expectations stocks bond yields year highsnew york ap stocks technology companies health care companies bond prices yields year treasury yield year highs companies treasury department sanctions producer metals prices index points dow jones average points percent composite points percent russell index company stocks points percent oil loss percent york brent crude price oils percent barrel gasoline percent heating oil percent gas feet advertisement ,Business
bybusiness pressmay talks rivalry officials tensions world economies trade war delegation treasury secretary days talks dispute rivalry technologies semiconductors decades edge microchips silicon smartphones cars intelligence wilmington trust officials fraud conspiracywilmington del executives institution connection bank bailout program fraud conspiracy charges jurors wilmington trust executives prosecutors wake crisis defendants regulators investors wilmington trust amount estate loans bank alleges vw knew emissions jury detroit volkswagen ceo martin charges company diesel emissions scandal plot prosecutors top world count indictment thursday charges counts wire fraud executives employees air act fund investing york investors fund expenses year percentage investments costs things investors portfolios stocks bonds world months fund fees predictors success researchers record exports deficit ap record exports trade deficit march time months commerce department trade gap september president donald trump deficits trade agreements practices partners food chefs hype sign industry change boston robots souffle burrito restaurant boston kitchen ingredients bowl robot tech novelty machine experts food industry automation years bill push bill melinda gates poverty years announcement thursday foundation issues health development critics gates home specific programs grants initiatives data projects community activists services firms april pace yearwashington services firms pace april month companies cost pressures tariffs shortage workers institute supply management services index march reading index year reading sign expansion services sector months years buying drive loss york ap buying drive loss stocks weakness health care companies banks indexes health quarter aig gains technology companies losses tesla loss investors ceo elon musk analysts questions company conference index points percent dow points nasdaq composite points percent russell index company stocks points percent crude loss percent york brent standard percent gasoline percent heating oil percent gas percent feet advertisement ,Business
bybusiness pressmay rate notes inflationwashington reserve benchmark interest rate notes inflation years fed target fed term rate percent level march increase december data firm center facebook privacy scandal york data firm center facebook privacy scandal bankruptcy cambridge analytica information facebook profiles portion electorate statement cambridge analytica actions part advertising businesses smokerswashington employers step marijuana drug employees fixture employers years workers experts time jobs decades men starbucks ap men philadelphia starbucks anything city officials program men lawyer mayor jim kenney agreement wednesday arrest rashon nelson donte robinson april furor profiling memo pruitt landlord husband work clientwashington ap memo husband scott washington landlord appointments behalf client year memo august shows hart committee appointments behalf client hart passengers popping southwest planecleveland ap passengers window southwest airlines cleveland reports injuries flight chicago jersey morning emergency weeks southwest airlines plane emergency landing philadelphia engine explosion tesla posts record loss cash burn ap tesla loss quarter cash numbers model mass market car loss cash burn wednesday questions company future bills year borrowing round stock sales author dodd frank bill foundation congress rewrite banking law name massachusetts congressman isn frank frank efforts bill democrat connecticut dodd crisis gop house legislation government role bill fries taco bell kfc drags york ap taco fries diners quarter orders spicy fries sales growth parent company yum brands sales shortage kfc chain restaurants skid stocks apple climbsnew york ap stocks thanks afternoon slump health care companies food drink makers losses apple results forecast stock reserve interest rates meeting investors index points percent dow jones average points percent composite points percent russell index company stocks points percent crude percent york standard percent barrel gasoline percent heating oil percent gas percent feet advertisement ,Business
bybusiness pressapril fight europe sanctions expireswashington administration risks trade battle europe trade talks china week trump union countries steel aluminum tariffs month bids andeavor fuel realmsan antonio ap drivers note prices pump marathon petroleum refiner pipeline owner andeavor refiner reach marathon findlay ohio operations east andeavor tesoro operations west govt time warner deal consumerswashington government case monday time warner consumers trial crept end decision judge merger deal justice department attorney day trial conrath competition pay tv industry deal harm consumers sprint dealnew york ap sprint mobile merger investment speed wireless technology service competitiveness reasons combination fronts wireless costs consumers home sales march gainwashington americans contracts homes march mortgage rates shortage houses contract signings year association realtors home sales index percent month corporations tax cuts jobswashington ap sen marco rubio businesses windfall president donald tax cuts workers economist evidence money worker rubio contender nomination tax cuts fed rates yearwashington reserve interest rates week growth inflation pressures fed path rate hikes year bank board raft appointees president donald fed approach rates recession court class action settlement casewashington court settlement class action lawsuit google settlement agreement money organizations engine users court case lawsuit users google privacy rights search terms users government suffers defeat house government pressure brexit home defeat parliament say exit deal union votes house lords amendment government brexit bill decision power outcome negotiations eu power divorce borrowing set record billionwashington treasury department government record march quarter needs april quarter treasury monday borrowing quarter record set quarter period country recession system crisis stocks telecom companies marketnew york ap stocks burst market increase january company earnings index points percent composite points percent dow jones average points percent russell index company stocks points percent crude cents barrel brent standard cents gasoline gallon heating oil percent gas percent feet advertisement ,Business
review questions virtues business book entry jonathan knee share page photo argues businesses driver productivity record issues credit press topics populace virtue business decline family farm coast realist role firms job creation silicon valley entrepreneur dreaming status quo restaurant garden everyone reason businesses view robert atkinson michael authors myth business america predisposition guy effect economy society evidence mr atkinson mr lind opposition cult business america authors indicator wages productivity protection employment diversity tax compliance firms group firms wisdom businesses engine job growth economy attack points research job creation origin business job creation myth majority businesses account job losses contribution job creation research article notes ups company anyone founder years number attitude superiority firms fact share employment economy firms engine job growth job seekers systematically wages benefits diversity times unemployment advertisement consensus favor things array laws benefits exemptions authors policy wonks careers succession think tanks devote book history rules alternatives approach tax dozens topics popularity neutrality defends policy proposals benign principle size neutrality arguments positions view overuse policy jargon instance philosophy developmentalism opponents approach enforcement brandeisians way companies medium ones email re enter updates products error regardless validity policy prescriptions data mr atkinson mr lind question wisdom attitudes business relative law society look trends graduates programs firms percent graduates programs investment banking management consulting jobs decline attractiveness industries mater stanford business school percent graduating class investment banking advertisement stanford heart silicon valley today graduates company percent preference business extends stanford symposium business schools columbia business school dean harvard business school percent graduates companies employees shift companies employers preference business schools conference wharton dean form action company recruitment efforts atkinson mr lind businesses driver productivity record issues rejection corporations corporations facebook scandals blame disfavor contempt interest ways corporations trust graduates knee professor practice columbia business school advisor book class clowns investors billions education feedback book entry review empire guns role war industrialization apr picture entertainment industry mar america rights internet review views silicon valley influence see ,Business
bybusiness pressapril hope visit delay tariffswashington ap treasury secretary steven delegation officials week analysts trade conflict china outcome one talks delay series tariffs nations goods windows adapts business importance declinesredmond wash ap earnings report windows core business complement company offerings company money windows share business thursday quarter revenue increase percent year contrast windows revenue percent profit doubles shares york ap quarter profit year wall street expectations stock percent hours seattle company income share months march earnings share per share analysts bookings fall accidentdallas inspections jet engines airlines fan blade year others week investigators flight southwest executives thursday fan blades signs metal fatigue mid bookings accident southwest oregon struggles pot problemsalem oregon data marijuana industry workers businesses experience challenge pot industry ability governments markets state contractors problems sales computer system months mortgage rates year washington ap term mortgage rates week level years home purchasers prospects spring buying season week increases term mortgage rates mortgage buyer mac rate year rate mortgages percent week rate year rate loans percent week interest stocks comeback york ap investors stocks percent days market losses gains trade dispute china record highs january analysts market direction bank growthfrankfurt germany bank interest rates settings signs economy markets bank president mario draghi assessment news conference stand pat decision bank member council facebook tech stocks york ap stocks facebook technology companies market interest rates year highs days stock price month data privacy scandal shares controversy didn media platform business quarter technology companies alphabet microsoft losses index points percent dow jones average points percent technology nasdaq points percent russell index company stocks points percent oil percent york brent crude price oils percent gasoline percent heating oil percent gas percent feet advertisement ,Business
business day business highlights pressapril share page sears shareholder offers york ap sears shareholder company kenmore brand estate holdings buyer company brands remainder powerhouse retailer world wars depression home sales percent marchwashington sales homes percent basis march buyers number properties market association realtors homes month pace sales rate sales months damage warshanghai consumer brands press partnerships commerce giant alibaba traffic products sales companies billions revenue alibaba perks exclusivity anyone trump coal mean president donald trump coal miners administration wind energy projects offshore leases power projects east coast goal grid energy power millions homes projects jersey virginia york advertisement survey economists outlook tax cutswashington ap america business economists picture months survey companies sales pay time thirds respondents survey association business economics president tax cuts way hiring investment plans advertisement court wrestles law judge casewashington court case adviser buckets money strategy raymond lucia appointment law judge case securities exchange commission law judges potential impact law judges government summer movie preview hollywood actionlos angeles summer year hollywood record release avengers war thursday marquee marvel superheroes time box office year percent industry summer hits wonder woman performance decade email re enter updates products error denver price value denver post cry help form editorial ownership colorado community tries rescue mission paper denver newspaper industry ad revenues lights sales plunge york repercussions demise toys hasbro loss plunging revenue quarter hasbro sales toys stores ad sales parent alphabet view calif ap google parent alphabet jump quarter income back ad sales accounting adjustment mountain view california company income percent expectations revenue expectations stocks bond yields year highsnew york ap stocks technology companies health care companies bond prices yields year treasury yield year highs companies treasury department sanctions producer metals prices index points dow jones average points percent composite points percent russell index company stocks points percent oil loss percent york brent crude price oils percent barrel gasoline percent heating oil percent gas feet feedback ,Business
