Article,Category
australia office sex waleed alymarch imageformer nationals party leader minister barnaby joyce center parliament canberra monday quit party leader minister allegation creditrod mcguirk australia politics days feels people magazine journalism rumors sex news barnaby joyce minister affair aide joyce leadership post backbench government response scandal mr joyce predicament matter minister malcolm turnbull view ban sex ministers staff acknowledgment power imbalances government office truth hi degradation country culture relationship minister staff member offense corruption conflict interest rumor office sex game inquiry press sex matter interest effect politics days joyce resignation michaelia cash minister jobs innovation party joyce scandal office sex bill leader opposition labor party subject rumors years relationships staff members context joyce matter home affairs minister peter dutton explicit cash radio interview morals lecture bill relation joyce weeks people hi problems bill life labor party craw truth morals mr turnbull labor response mr joyce travails questions relationship funds minister transfer mr joyce employee offices minister affair office code conduct ministers cash comments problem cash mr joyce judgment politicians centuries culture mr joyce punishment affair cash something journalist duty rumors politicians duty days party decide candidates sex visits brothels swingers clubs relationships mr turnbull attempt power imbalances ministers staff concern sex power ministers offices office conduct way behavior matter interest rules means ban agency staff members relationships circumstances member parliament ban office sex politicians ministers power imbalance people ages relationships age gap relationships class disparity turnbull sex ban stand ban support move labor party policy control government policy office sex focus energy promises disservice run politics aly broadcaster politics monash university opinion section facebook twitter nytopinion opinion newsletter coverage discussion facebook group australia letter day morning version article print page order reprints paper subscribeadvertisement ,Politics
italy artists jason faragomarch milan prelude elections month league party subtlety leader matteo salvini islam incompatible values rights freedoms currency crime humanity league politician attilio fontana race presidency lombardy region city landslide league campaign manifesto dig strident immigration muslim rhetoric tone italy thousand cultures valley heritage flourishes party proposals art institutions churches heritage sites cousins fan president populists defenders institutions make italy vision highlights migration policy mr salvini party nationalist project hi art wingers promises culture days march elections papers likelihood populist coalition poll exhibitions art politics points hi view fondazione prada milan strozzi florence questions culture surface life shows fondazione prada post zang tumb tuuum life politics month car crash title poem tommaso godfather futurism paintings sculptures design objects era likes giorgio di chirico giorgio morandi gino severini dozens documents rise fall art world achievement exhibition making engagement immaculate design exhibition post zang tumb tuuum graphs size paintings sculptures pradaunlike germany regime boundaries mussolini style italy artists power culture service state number forms abstraction generation futurists figuration painters return order artists politics time turn artists regime participate construction iconography post zang tumb tuuum answers art order something circumstances graphs works situ venice biennale quadriennale homes artists studios size paintings sculptures backdrops show art galleries rome milan turin judgments quality significance show mastermind curator germano heroes designers york agency prada stores foundation exhibitions image exhibition york agency prada stores fondazione prada creditfondazione pradaa color life bottles table morandi peace fascism exhibition mock classicist busts wildt show venice biennale mussolini intensity emperor chirico pictures stringy bare gladiators apartment roman museum athletes imageadolfo wildt il puro folle parsifal creditfondazione musei civici veneziainstead clarity cube post zang tuuum view decades il duce garde agitprop styles horror imageadolfo wildt il puro folle parsifal capital event art creditfondazione la di romait distinction exhibitions manifestations prada deposito ware mr projects dozens installation shots exhibition revolution rome anniversary regime epic show visitors hi hybrid ceremony affair leader walls slogans clippings popolo italia newspaper way statues regime men shrine crucifix light fondazione prada show dawn nation palazzo strozzi florence exhibition offers window art reconstruction post zang tumb tuuum material gallery newsreel montage foundation republic dolce vita imagemimmo king kings creditmimmo rotella siaethe past age mimmo rotella canvases posters technique collage mussolini placard advertisement swords sandals film boom freedom art gallery dozen paintings sculptures monochrome fontana foam rubber canvas giulio turcato works piero manzoni bread rolls balls excrement genius consumerism imagemario schifano comrades collection fondazione marconi avant garde time languages left rome pop artist mario schifano boys hammers sickles prog rock jail drugs charges turin collection artists materials hierarchies arte man term germano curator post zang tumb tuuum penone creditprivate collection paolo mussat sartor penone giuseppe penon dawn nation closes works povera giuseppe penone rovesciare propri eyes artist contact world viewer curators dawn nation eyebrow proposition penone graph nation hi period tension years projection mr penone sense art precision post zang tumb tuuum baseless imageluciano fabro italy creditmasi event work dawn nation web art politics luciano fabro italy steel cutout boot europe hangs ceiling way wire stretches calabria piedmont dangles floor swings air prosciutto body mussolini milan square e ly march citizens sort government italy feels portrait country post zang tumb tuuum life politics june fondazione prada milan dawn july florence palazzostrozzi version article print page york edition headline art strokes politics order reprints paper sistine chapel life blessingmarch imagerome subway project marvelsmarch imageadvertisement ,Politics
art design notebook italy artists demagogues jason faragomarch share page milan prelude elections month league party subtlety leader matteo salvini islam incompatible values rights freedoms currency crime humanity league politician attilio fontana race presidency lombardy region city landslide league campaign manifesto dig strident immigration muslim rhetoric tone italy thousand cultures valley heritage flourishes party proposals art institutions churches heritage sites cousins fan president populists defenders institutions make italy vision highlights migration policy mr salvini party nationalist project hi art wingers promises culture days march elections papers likelihood populist coalition poll exhibitions art politics points hi view fondazione prada milan strozzi florence questions culture surface life shows fondazione prada post zang tumb tuuum life politics month car crash title poem tommaso godfather futurism paintings sculptures design objects era likes giorgio di chirico giorgio morandi gino severini dozens documents rise fall art world achievement exhibition making engagement immaculate design exhibition post zang tumb tuuum graphs size paintings sculptures credit fondazione prada germany regime boundaries mussolini style italy artists power culture service state number forms abstraction generation futurists figuration painters return order artists politics time turn artists regime participate construction iconography advertisement post zang tumb tuuum answers art order something circumstances graphs works situ venice biennale quadriennale homes artists studios size paintings sculptures backdrops show art galleries rome milan turin judgments quality significance show mastermind curator germano heroes designers york agency prada stores foundation exhibition york agency prada stores fondazione prada credit fondazione prada color life bottles table morandi peace fascism exhibition mock classicist busts wildt show venice biennale mussolini intensity emperor chirico pictures stringy bare gladiators apartment roman museum athletes adolfo wildt il puro parsifal credit fondazione musei civici venezia clarity cube post zang tuuum view decades il duce garde agitprop styles horror adolfo wildt il puro folle parsifal capital event art credit fondazione di roma distinction exhibitions manifestations prada deposito ware mr projects dozens installation shots exhibition revolution rome anniversary regime epic show visitors hi hybrid ceremony affair leader walls slogans clippings popolo italia newspaper way statues regime men shrine crucifix light fondazione prada show dawn nation palazzo strozzi florence exhibition offers window art reconstruction post zang tumb tuuum material gallery newsreel montage foundation republic dolce vita mimmo king kings credit mimmo rotella past age mimmo rotella canvases posters technique collage mussolini placard advertisement swords sandals film boom freedom art gallery dozen paintings sculptures monochrome fontana foam rubber canvas giulio turcato works piero manzoni bread rolls balls excrement genius consumerism mario schifano comrades credit collection fondazione marconi milan avant garde time languages left rome pop artist mario schifano boys hammers sickles prog rock jail drugs charges turin collection artists materials hierarchies arte man term germano curator post zang tumb tuuum giuseppe penone eyes credit collection paolo mussat sartor penone giuseppe penon dawn nation closes works povera giuseppe penone rovesciare propri eyes artist contact world viewer curators dawn nation eyebrow proposition penone graph nation hi period tension years projection mr penone sense art precision post zang tumb tuuum baseless luciano fabro italy credit masi lugano event work dawn nation web art politics luciano fabro italy steel cutout boot europe hangs ceiling way wire stretches calabria piedmont dangles floor swings air prosciutto body mussolini milan square e ly march citizens sort government italy feels portrait country post zang tumb tuuum life politics june fondazione prada milan dawn july florence palazzostrozzi version article print march page york edition headline art strokes politics order reprints paper feedback page coverage sistine chapel life blessing march subway project marvels ,Politics
region actress governor performance politics city ginia bellafante share page cynthia nixon fame show luxury city gulf york core message campaign office credit sam hodgson morning brooklyn cynthia nixon campaign venture case herself governor york liberal left choice venue bethesda center church brownsville neighborhood york city demographics audience americans population governor andrew cuomo investment schools effort inequality capitulation moneyed interests state legislators biography child mother floor graduate york city schools children woman college education assertion actress fact thing opponent back room dealing coddling affiliations role player mr sincerity democrat problem ms nixon performer ideologies years zephyr law professor term run results primary legislation years hour minimum wage family package justice reforms actions bail delays adjournments court proceedings people jail advertisement stagecraft monday ms nixon cuomo state attorney general ways manhattan district attorney cyrus vance jr allegation assault harvey weinstein newsletter sign please box email address please enter newsletter updates offers products services thank error try view newsletters manage email preferences policy opt speech ms nixon investment city housing system days appearance jackson s bronx governor housing secretary president bill clinton state emergency buildings york city housing authority management team city state funds agency monitor advertisement war governor mayor bill blasio cuomo hindrance ms education activist supporter mayor mr blasio constituents advantage race hours ms speech tuesday city council speaker christine quinn gay ally governor york post ms nixon lesbian bid mayor years mr term ms quinn part pitch voters mr tale cities focus gaps ms nixon space city tyranny plutocrats celebrity fortune product sex city vision york opposition values series entertainment image city luxury brand consumer paradise day pair shoes vessel message ginia bellafante twitter version article print march page york edition headline actress governor performance politics order reprints paper feedback page coverage cynthia nixon cuomo democrat campaign debut march opponent status aug city column life culture politics policy york city playwright poverty rejects luck statue doctor experiments ideas facebook generator envy dread fear born gentrification politics andrew cuomo emasculator see ,Politics
byop ed contributorhow democrat trump countryby tom ferrick jr march imageconor lamb polling station lady victory church carnegie pa tuesday candidate conor lamb race election pennsylvania district headwinds type snow easter week starters trump district points district republicans years pacs millions tv time murphy abortion republican election pittsburgh post gazette year mistress abortion leaders mr murphy man candidate saccone era trump trump trump trumps voters th pittsburgh suburbs slithers way gerrymandering fashion towns areas virginia border wonder saccone race favorite race saccone absentee ballots lamb lead votes wednesday news media absentee ballots split vote polls lead problem campaigns theory fact factors candidate personality effectiveness field effort advertising position issues cutout election night rally canonsburg pennsylvania imagesmr saccone blanket candidate scintilla charisma care rallies streets voters pacs saturation tv ads saccone campaigner mr lamb one sum prosecutor scion family mount lebanon stamina desire door door suit tie block visits resident witness race th door referendum trump tuesday turnout portions district mr lamb showing county voters republicans votes saccone votes counties democrat county commissioner trends victory theory voters minds credit mr kopas substitute candidate anything kind person people articulate picture people congressman voters politics weekend cecil president mine workers bag compound adjectives rally union gun job pension th anger zone state politics contrarians dislikes progressives abortion politicians philadelphia anti gun gooders list demise coal steel industries revenge class someone david levdansky state legislator county union democrat years mr saccone votes years rematch mr saccone defeat collapse core industries cadre voters mr levdansky voters change officials office mr saccone voters meat issues cuts education services pennsylvania mr saccone bill schools god building gun owners weapons permit clinton chance th mr anger president trump district rally night minutes crowd mr saccone minutes saccone clone mr lamb resemblance pennsylvania senator bob casey union abortion mr lamb position abortion laws mr casey brand politics guy persona work pennsylvania senate mr casey th percentage points man santorum man district senate era mr casey centrist progressives people voters lamb test purity party wing future party democrats insight trump appeal act soap democrats territory th note term lease district offices storm fury millions th form state court district lines election republicans court redistricting case lead seat fall year term image results rorschach test trump party tom jr reporter government politics follow opinion section facebook twitter nytopinion opinion newsletter advertisement ,Politics
books abortion books jennifer szalai share page credit sonny issues consuming abortion watson talk talk rates abortion decline term contraceptive use watson points scarlet ethics law politics abortion procedure practice pregnancies abortion number abortions term miscarriages women abortion lifetime silence perpetuates abortion statistics void advocates sides watson abortion abortion rights activists abnormalities year olds abortion activists pregnancies viability cases understanding abortion cases ones ones writes something abortion conversation watson bioethicist school counsel liberties union illinois debate convictions years roe wade abortion right fact majority americans favor abortion legality feelings abortion complexity decision right decision advertisement guide ways abortion scarlet way katha pollitt abortion rights americans middle debate abortion women measure control childbearing lives watson goal scarlet americans day age watson credit john end anecdote trip wheel hospital year behest pope compartment parents baby care strangers time children tiber river spinning year wheel question roe wade hybrid book part part exegesis part tract part guide watson assumptions positions ethics abortion something access abortion doll problem anti woman sex pot motivations guise morality issue trouble terms choice life arguments court decisions masterplots assumptions approaches abortion ethics issue matter biology autonomy health connection decline blockades rise abortion laws please box email address please enter newsletter updates offers products services thank error try view newsletters manage email preferences policy opt watson shoals readers bland flag neutrality claim neutrality plurality warning claims embryos fetuses women anything watson abortion debate status embryos cannot degree government intervention behalf embryos fetuses end uncertainty status women people commitment variety experience means condemnation congressman supporter life values wife pregnancies hypocrisy example someone pregnancy reasons relationship troubles fear disability watson notes discrepancies moralizing decision making abortion providers number patients partners pregnancies others spirit circumstances people ly upsets silence doesn help matters selves knows conversation everyone things way hope jennifer szalai twitter jenszalai scarlet athe ethics law politics abortionby katie watson pages university press version review print page york edition headline abortion paper feedback page books book reviews critics barracoon man trauma slavery care kinship moralist woodrow wilson hazards idealism someone someone crime mystery racism corruption apr raft books motherhood angle apr ,Politics
borderfrom museums mountains mariachi mexico ciudad ju creditchrist chavez juli border states mexico news day debates immigration spending security initiatives destinations border writers travel time pairings places tex matamoros park diego tijuana nogales nogales mexico paso ciudad ju rez sat market ju rez weekday clanking glass greeter visitors corner restaurant smell grease eatery axl jukebox vendors downstairs shirts image singer juan gabriel chest others visitors price homemade poncho logo dallas images excursions ju rez father child way memory flashbacks teenage buckets beers friends south border day biology imagethe cafe el paso creditchrist chavez i tens thousands mexico el paso week notion lawlessness border cities americans bay days declarations passport states government s border enforcement thousands pasoans ties ju rez effects rio grande texas trade partner el paso customs district way trade mexico total states heart ciudad ju rez street parishioners centuries park plaza guards shop city government office centro artes public museums attractions city officials street vendors visitors city lawmakers rights groups world years view ranger peak el paso creditchrist chavez blocks avenida museum spirit episodes mexico museo revolucion museum customs building war mexico renovations sleekness graphs figures francisco madero venustiano carranza francisco pancho villa areas ju rez importance city war emphasis americans mayhem case exhibition john expedition pursuit villa rebel leader forces columbus writers reed bierce americans war mexico part space graphers writers herskovits kiefer strauss curiosity dedication journalism war readers texas museum downtown paso del norte bridge sense adventure ju rez visitors violence sight police truck soldiers rifles visitors ju rez creditchrist chavez i routine patrols stop day trip kentucky club bar business americans need beer whiskey tequila prohibition reputation place patrons sides rio grande pubs doors drug cartel wars city beer margaritas hours end patrons screen televisions hand bar evening wears seats music louder cathedral museums ju rez visitors uber city villa mar los arcos restaurants seafood dishes mar family owners branch el paso drug violence location ciudad ju rez time arcos family friend dish bacon beer bottle water pesos margarita club ciudad ju creditchrist chavez closer bridge americas chamizal park stages hour pageant everything roots culture song dance buffet dinner reservations pasomuch el paso identity remoteness time zone texas capitals states mexico chihuahua mountains desert distinctions city ends mexico begins mom terrace neighborhood father blocks foothills franklin mountains part city town goat farmers neighborhood city school work number years advantage franklin mountains hiking trails mountain peaks friends media bike rides excursions mountains options entertainment spots states wyler tramway hikers visitors feet sea level fort bliss class neighborhoods el base country division states army spreads texas mexico acres land hi view ironsides museum base exhibits hi base division efforts americans world war ii plaque tank honors devora garcia zacatecas mexico clint tex combat operations iraq admission museum visitors pass base time weekends bliss reason el pasoans city highways route patriot freeway war ciudad ju rez el paso downtown renovation return league baseball city el paso affiliate diego padres university park deadbeach brewery dozen spots craft beers food truck meals deadbeach imagethe speak jazz band playing tap bar el paso creditchrist chavez el paso food mountains people enchilada menudo el paso exhibit caf towners chicken mol chicken enchiladas tap bar haunts el paso jukebox tigres norte marty robbins minutes addition mountains sunsets legend villa residents ju rez el paso something rest cities rio grande mexico minutes el paso sunland park racetrack casino way people south rio grande states visit sunday border entertainment consist impersonators tribute rat pack something flavor mariachi band juli reports politics border affairs texas version article print page tr york edition headline music patriotism hills order reprints paper subscribeadvertisement ,Politics
byop ed contributorlatin leadership voidby jennifer piscopofeb leer chile president michelle bachelet chile leaves office march latin america presidents time region laura chinchilla costa rica cristina argentina dilma rousseff brazil bachelet america prospects presidents future regions america action laws gender gap leadership gains women positions needs limits remedies women laws candidates opportunities women politics attitudes country women congresses numbers thanks quotas world law candidates congress parties women percent positions half parties slates women countries quota parity law candidates women percent seats costa rica ecuador mexico bolivia majority legislature states comparison women percent representatives percent quota laws number candidates parties women ballot positions portions budget leaders action laws women crises bachelet mrs kirchner ms rousseff ms chinchilla incumbent parties president region leaders presidents left ms bachelet mrs kirchner ms rousseff pink wave leadership america period region commodities boom flush resources countries protections workers peoples people women party economies security concerns citizens parties coalitions voters incumbents men women women men standard male leaders chinchilla presidency failure economy percent percent term ms bachelet favorability allegations son daughter law estate president sebasti pi era effects allegations invoices campaign congress ms rousseff office accounting practices brazil evidence enrichment rousseff president michel temer men cabinet country nonwhites majority mr temer accusations corruption rousseff allegations subordinates money vote right latin america candidates days left chinchilla departure costa rica leader epsy campbell politician descent ms campbell barr bid party nomination president approval ratings competitors right politician lady margarita zavala poll numbers path nomination campaign presidency video party ranks events research parties left nominate women voters economy parties sides women competition latin america disillusionment growth parties choices voters seats party parties seats appear chances women women office discrimination glass ceiling latin america average women management roles women percent board seats latin america economies legislatures women parties delegations committees colombia study quarter officials resources parties percent mayors treatment resistance politicians forms parties quotas women juana quispe councilwoman bolivia death parity laws matter support politicians chile gender quota legislature number women congress election right comeback sexism hostility women power attitudes impunity violence women rica notions quotas society sector law organizations gender parity leadership positions service organizations men positions women power politics business men something jennpiscopo assistant professor politics college opinion section facebook twitter nytopinion opinion newsletter version article print order reprints paper subscribeadvertisement ,Politics
