Article,Category
clinton politics star midterm york months clinton presidency position power government office clinton party midterm strategy control congress grabs fall gop players plans clinton villain attack ads democrats strategy races pennsylvania indiana dakota resilience potency voters clinton democrats clinton era republicans stop pelosi lamb pamphlets election pennsylvania year taste elections closer gop strategy elections trump presidency promise clinton paid media motivator bliss leadership fund action committee tens millions dollars house races fall nancy pelosi touch positions critics strategy reeks desperation sexism democrat house time decade republicans ghost clinton approval ratings choice republicans clinton politics year organization trump resistance groups appearances week remarks shot trump slogan appeal middle campaign america backwards clinton gop ads clinton comments image senate candidates election states backwards ad sen bill bill nelson way clinton president ad won clinton spotlight party plans races regions feature midterm season races places pennsylvania district republicans millions month election democrat lamb election flood attack ads polling focus groups campaigns clinton profile democrats nation house minority leader percent americans clinton december gallup poll time mark trend candidates popularity time committee spokesman gorka clinton target media focus president barack obama office year clinton government cases republicans clinton indiana candidate steve braun attack primary conservatives clinton ballot state pac tv ads braun clinton days spokesman requests comment clinton staffer strategist jesse ferguson strategy act desperation gallup week job approval clinton obsession evidence nothing president ferguson guy office water cooler school football championships ground races democrats strategy sen heidi heitkamp re election november month radio interview clinton sunset heitkamp philadelphia candidate greg edwards sen bernie sanders election clinton sides think election interview candidates decision presence choice advertisement ,Politics
bysports movement sportsimagethe states team gold women gymnastics london olympics member team mckayla maroney team doctor period years macuroct names course gymnastics sports judo hockey basketball girls women time brave athlete forward maroney champion message morning dr larry team doctor women gymnastics team olympic team maroney name list gymnasts nassar list women share stories people hollywood maroney reference harvey weinstein revelations media women experiences maroney gymnasts accusations crimes dozens minors career levels harassment abuse rape point point women athletes levels gymnastics nassar appointments weinstein nassar jail trial counts conduct pornography charges accusations assault decades prison time regardless charges lawsuits gymnasts stories maroney wednesday maroney odds hand maroney abuse hands nassar gymnast olympic gold medalist tatiana gutsu facebook doctor olympic teammate vitaly scherbo years monster prison years medal summer games years team doctor position creditchang wave honesty sheer numbers woman none hearing abuse sports march rick chief paralympic sports states committee sat gymnasts olympic community people people athletes ones ones ones burden abuse years lips hearts ones parents coaches adults children ones gymnastics team training camps bela martha texas ranch gymnasts rooms athletes nassar techniques stories secrets gymnasts careers line wherever position power abuse maroney dream olympics things nassars weinsteins world women stories time nascar driver back trailer interview cars racetrack door team publicist door time driver hand leg group interview meeting olympics man relations office door way room experiences course woman sports ways moments job anyone details situations boldness women hands curtain problem nothing silence abusers version article print page york edition headline sports women order reprints paper coverageolympic gymnast mckayla maroney team doctoroct imageex gymnastics career swift success years scandalmarch abuse charges gymnastics higamckayla maroney oct imageadvertisement ,Sports
books things book minds sports fans john share page credit patricia heart broken nerves event someone journalist los angeles george field night phone rabid fans fan depth devotion blindness root causes thinking conduct ignorance book heart sports fandom dohrmann time reporter sports editor spoke fans academics scientists mania kids fans admiration soccer player clint dempsey idea book curiosity people team favorites life person dame football california giants baseball warriors basketball teams obsession states men soccer team level people journalist journalism colleges death threats fans people love sports kids year year fandom years moment book books someone fandom aren sox fan book sox fan something people country way advertisement thing credit adam moore harter psychologist kids parents kids adolescence bay packers time pictures eagles fan videos patriots team harter kids world world sports kids fact teacher auburn fan doesn person daddy team season game game home kids tv please box email address please enter newsletter updates offers products services thank error try view newsletters manage email preferences policy opt way book book fan engagement book opportunities athletes fans things make athletes part fandom blazing trap fans behavior book fans person writer work time team player dempsey soccer development system conveyor belt someone system top risks field greatness greatness something something anyone work shots someone superfans words lot people sports fans wives brothers sisters roommates people book eyes behavior reasons interview john williams twitter johnwilliamsnyt heart sports fandomby george dohrmann pages books version article print page york edition headline team order reprints paper feedback page ,Sports
sundayreview news analysis college sports tax dodge mike mcintiredec share page credit marta york university program years macaroni company decision congress college sports college business taxation football bowl season colleges tax law president trump train provisions coaches salaries donations purchases plans television revenue sponsorships income streams athletics multibillion dollar business changes sports tax beneficiary subsidy culture money time college sports year collegiate association division sports programs indictments college coaches executive bribes basketball players agents prosecutors statement influence money coaches student advertisement tax nature college sports cause problems fuel engine pull sense decency balance sheet coast conference home champions football clemson men sponsors gatorade geico conference tax return quarter dollars games member universities sports revenue commissioner success income tax bill taxes conference filing revenue service coast member schools organizations emphasis excellence coast conference opportunities student athletes quality life magic word student athletes amateurs activities professions college sports part mission schools income taxes interpretations law assumption era time college sports trappings profit driven business groves academe decades lobbying battles universities income taxes billions dollars broadcast rights sponsorships donations boosters moment response attempt tax exempt status profits mueller company pasta maker law school congress business income tax revenue organization mission threat lawmakers tax money school sports programs committee reports activities schools functions benefits football basketball escape hatch college sports years agency stream television revenue college games business income campaign colleges declaring tickets fans school stadium games television audience power college sports television viewership example east conference year operation right games decades offer rights attempts tax college sports profits lawmakers congress end run sponsorships advertising business income tax tax plan lawmakers course deduction booster donations sale game tickets excise tax college employee salaries athletics revenue s tax college sports machine entertainment scandals equivalent islands tax dodge president trump tax profits billions plain sight campuses home mike reporter author champions way football florida soul college sports opinion section facebook twitter nytopinion opinion newsletter version news analysis print december page sr york edition headline college sports tax dodge order reprints paper feedback page ,Sports
byq things book minds sports fansby john williamsfeb imagecreditpatricia heart broken nerves event someone journalist los angeles george field night phone rabid fans fan depth devotion blindness root causes thinking conduct ignorance book heart sports fandom dohrmann time reporter sports editor spoke fans academics scientists mania kids fans admiration soccer player clint dempsey idea book curiosity people team favorites life person dame football california giants baseball warriors basketball teams obsession states men soccer team level people journalist journalism colleges death threats fans people love sports kids year year fandom years moment book books someone fandom aren sox fan book sox fan something people country way thing moorei harter psychologist kids parents kids adolescence bay packers time pictures eagles fan videos patriots team harter kids world world sports kids fact teacher auburn fan doesn person daddy team season game game home kids tv way book book fan engagement book opportunities athletes fans things make athletes part fandom blazing trap fans behavior book fans person writer work time team player dempsey soccer development system conveyor belt someone system top risks field greatness greatness something something anyone work shots someone superfans words lot people sports fans wives brothers sisters roommates people book eyes behavior reasons interview john williams twitter johnwilliamsnyt heart sports fandomby george dohrmann pages books version article print page york edition headline team order reprints paper subscribeadvertisement ,Sports
sundayreview news analysis russia way glory rebecca ruizdec share page president vladimir athletes winter olympics credit mikhail agence france presse images president man question owner russia department store trump deal universe pageant years question mr office kremlin weeks states intelligence agencies russia election interest trump dolls president face stalls holiday markets topic hand election russia cheating winter olympics russia subversions sports democracy intelligence agents cyberespionage team millions dollars investigations confidence purity sport strength democracy breaches heart president vladimir putin russia democracy world sports mr kusnirovich group figures sports group summer mr putin revelations nation medals sochi steroid martinis hundreds ounces urine stealth country security service advertisement kremlin details schemes russia winter games state athletes uniforms flag games pyeongchang south details sports scandal whistle blowers insider insights case study russia drive methods part motivation presidency intelligence report year states officials attacks election mr putin payback doping scandal effort month medals olympians putin disqualifications states re election fact sports regulators investigators investigations russia doping canada leadership charge athletes switzerland president country samuel schmid investigation olympic committee sanctions sports officials evidence russia fraud documents lab analyses glass bottles urine signs allies counsel robert mueller year context election officials impartiality interest plain facts blowers facts russia chief chemist yuliya vitaly stepanov runner employee nation agency states locations years justice department interest evidence dr rodchenkov diaries day sochi states mutko russia deputy minister sports minister light suspicions extent nation chemist newsletter sign sign opinion newsletter weekday commentary ed editorial board writers world please box email address please enter newsletter updates offers products services thank error try view newsletters manage email preferences policy opt dr rodchenkov email wrongdoing exchanges meeting mutko chain events freedom email night dr rodchenkov account icarus russia olympic ban week officials denials acknowledge conspiracy state week sanctions athletes advocates sponsors concern crisis sports delay regulators olympic officials evidence cheating sochi critics sports officials russia transgressions olympic medals state schemes frailties drug testing controls independence authorities year questions separation power relevance politics result russia breaches questions trump attacks independence justice department defiance post watergate norms law enforcement partisan agendas way mr trump evidence russia interference election bach president olympic committee year evidence russia interference sochi olympic lab operations sports officials president body evidence russia lawmakers legitimacy mr mueller mandate decision making week mr bach process importance russia chance defense penalties athletes olympics set cyberattacks group bear intelligence officials intelligence unit records athletes emails officials ban russia hackers group emails committee servers election athlete records proof drug use stars simone biles williams athletes clearances substances question none information violation interview moscow year sports minister deputy minister putin russia sports things decks nation week olympics helm russia soccer world cup somebody responsibility july months mr putin master home correction version caption article location sochi russia rebecca ruiz correspondent sports justice department year opinion section facebook twitter nytopinion opinion newsletter version news analysis print december page sr york edition headline cheats sports elections order reprints paper feedback page hacking influence election coverage russia campaign election google buyers election ads identities loyalists washington insiders battles contradicts comey russia inquiry factor revelations president control joins attacks investigations coverage russia winter olympics dec insider state run olympic gold shows reach athletes sports dec ,Sports
monfils heat match djokovic open creditsaeed khan agence france presse imageswe reasons sports forefront mine athletes things things want air afternoon melbourne tennis player ga monfils middle match players time help surface temperature court degrees degrees stomach judges players tour year wasn dizzy heat stroke minutes court sets response chair umpire charge event water break news ga place players break points djokovic match haggard monfils limit level tolerance danger terms health limit world class professionals rackets sport signature events reason sports planet athletes levels genius chosen pursuits fraction abilities fetishization athletes elements route marathoner temperatures football player weather game genius circumstances element sports entertainment part entertainment genius work beauty performance day performance storage freezer middle desert oscar isn art cottage industry tundra spectacle ice bowl championship game packers cowboys field conditions wind chill minus degrees game lore moment football game packers starr fingers linebacker ray frostbite toenails band attendance play woodwinds kickoff norm schachter whistle lips skin mouth refs whistles play fan stands football men death game decades detriment men women pleasure fans weather enjoyment sports way sports quarterback throw pass game ball wind flutter duck anyone basketball game jump shots course team monfils match men star tennis players years roof climate environment sport conditions athletes n humane players athletes things break sports endurance tests entertainment athlete writer sports earth editor york magazine contributor sports founder deadspin opinion section facebook twitter nytopinion opinion newsletter advertisement ,Sports
magazine process words marc tracy share page credit illustration derek brahney year hinkie president manager philadelphia ers team franchise city cities titles route titles championships teams superstar way superstars draft draft rules advantage teams records hinkie reins fans strategy sixers teams bottom league finishes draft take results hinkie fans team losses look picture lot process couple years process process phrase process catechism brand fan joel talents hinkie plan nickname process fans philadelphia process throws time hinkie plan year season polarizing hinkie letter resignation draft procedures sports rules mechanics results system game blackjack chances dealer behavior table everyone odds casinos business way hands process life blackjack faith process crops realms year spokesman fears mueller investigation administration lawyers breath ty cobb lead process anthony scaramucci reign communications director health care system process market telecom airlines industries consumers years yorker article person process mantra class career venture capital buddhist advertisement process habit machine conflicts workings workings conflicts difference process series events process trial theory process antagonists say terms result absurdity kafka trial trial thing purpose title process states processes one amendment person life liberty property process law set rights process process offering litany protections convictions presumption innocence right attorney requirement guilt standard conception process source pride area life advertisement months question men misbehavior kind process consequences consequences people resignation profile job question people position answers process way position adviser rob porter reports abuse president trump thing process appearances porter court law porter hearing job trump administration please box email address please enter newsletter updates offers products services thank error try view newsletters manage email preferences policy opt november pressure representative john conyers accusations harassment minority leader nancy pelosi meet press process powers situation instance position committee answer process lets judgments mechanism system things responsibility questions positions columbia university instance union graduate students union labor relations board students matter litigation university provost january process course kind language process hands way police protesters democrats convention chicago party establishment hubert majority voters kennedy candidates exit vietnam war people age college sophomore mexico afterward adults process process something amendments bill rights rules voting representation humphrey richard democrats system commission donald fraser george peacenik senator dakota changes primaries power party bosses rank file elections candidates system mcgovern democrats rules authority party loyalists creation superdelegates superdelegates supporters bernie sanders emblem party establishment preference nominee clinton party convention committee commission voting recommendations measures number superdelegates caucuses participation party support changes tim kaine clinton mate month superdelegates influence nominating process recommendations audiences gauzy reassurance status quo commission member jan bauer des register home state alterations nation process marc tracy college sports reporter blog tablet magazine magazine award article magazine sign newsletter magazine inbox week version article print march page mm magazine headline schemes paper feedback page words language moment people companies brands politics backlash weather community someone rules news disaster apr advocate apr ,Sports
bygiving larry victims voicesimagethe gallery day dr lawrence dae smith state journal pressby meghan hearing lawrence gymnastics team doctor scores women abuse minors anomaly jan women impact statements court day simone athletes olympic games chorus voices statement twitter gymnast ear world media coverage case outlets indianapolis star news carla correa news editor women gymnastics rio olympics frustration group message slack resources days statements voices women number accusers abuse case sports time scale deputy editor news design desk team task opportunities visuals women s words anger power come abuser court face s editor beth flynn editors top couple days images permission s organizations graphics editor josh williams application presentation end friday number accusers days statements weekend carla time carla heroic task second hearing names quotations work database editors name portraits women court art directors lee online speakers multiple woman abuser court tears desk reason telling connection subject reason pieces heard hearing night scope problem women heart gymnastics combination dedication strength grace group gymnasts athletes scale abuse ground court stories power women voices nassar years prison larry nassar abuse women stories witnesses lives piece reporting scott cacciola christine hauser others women collection victims stories page interactive com sports insider stories twitter reader center readercenter version article print page york edition headline victims voices order reprints paper women accusers words jan sentencing death warrant jan imageadvertisement ,Sports
